### ISSUE TITLE
Add <searx.louifox.house> [IPV6 Only]

### ISSUE THREAD

**Issue by Tifox** [dalf/searx-instances#20]
customizations : 

- minimal modification on the logo on default style (oscar)

Others : soon HSTS enabled on root domain

Filtron ✅ 

`Mar 10 23:17:41 louifox-searx filtron[10288]: [log rule] 2020-03-10 23:17:41.730  POST 127.0.0.1:4004/ "q=test+toto&category_general=on&time_range=&language=fr" "Mozilla/5.0 (Macintosh; Intel Mac OS X 10.14; rv:73.0) Gecko/20100101 Firefox/73.0`

```
23:37:26.897135 IP (tos 0x0, ttl 64, id 26526, offset 0, flags [DF], proto TCP (6), length 60)
    localhost.44580 > localhost.4004: Flags [S], cksum 0xfe30 (incorrect -> 0x9efc), seq 966813014, win 65535, options [mss 65495,sackOK,TS val 1364460232 ecr 0,nop,wscale 9], length 0
23:37:26.897148 IP (tos 0x0, ttl 64, id 0, offset 0, flags [DF], proto TCP (6), length 60)
    localhost.4004 > localhost.44580: Flags [S.], cksum 0xfe30 (incorrect -> 0x00e9), seq 1739776563, ack 966813015, win 65535, options [mss 65495,sackOK,TS val 1364460232 ecr 1364460232,nop,wscale 9], length 0
23:37:26.897158 IP (tos 0x0, ttl 64, id 26527, offset 0, flags [DF], proto TCP (6), length 52)
    localhost.44580 > localhost.4004: Flags [.], cksum 0xfe28 (incorrect -> 0x28db), seq 1, ack 1, win 256, options [nop,nop,TS val 1364460232 ecr 1364460232], length 0
23:37:27.927198 IP (tos 0x0, ttl 64, id 4695, offset 0, flags [DF], proto TCP (6), length 69)
    localhost.8888 > localhost.54076: Flags [P.], cksum 0xfe39 (incorrect -> 0x4ea6), seq 3393917086:3393917103, ack 594332590, win 259, options [nop,nop,TS val 1364460489 ecr 1364460232], length 17
23:37:27.927210 IP (tos 0x0, ttl 64, id 51894, offset 0, flags [DF], proto TCP (6), length 52)
    localhost.54076 > localhost.8888: Flags [.], cksum 0xfe28 (incorrect -> 0x0d76), seq 1, ack 17, win 256, options [nop,nop,TS val 1364460489 ecr 1364460489], length 0
23:37:27.927295 IP (tos 0x0, ttl 64, id 4696, offset 0, flags [DF], proto TCP (6), length 461)
```

Morty ❗️  

```
result_proxy:
    url : http://127.0.0.1:3000/

tcp        0      0 127.0.0.1:3000          0.0.0.0:*               LISTEN      15069/morty

23:46:38.095927 IP (tos 0x0, ttl 64, id 20772, offset 0, flags [DF], proto TCP (6), length 60)
    localhost.57664 > localhost.3000: Flags [S], cksum 0xfe30 (incorrect -> 0x4d0c), seq 1531071531, win 65535, options [mss 65495,sackOK,TS val 1364598031 ecr 0,nop,wscale 9], length 0
23:46:38.095944 IP (tos 0x0, ttl 64, id 0, offset 0, flags [DF], proto TCP (6), length 60)
    localhost.3000 > localhost.57664: Flags [S.], cksum 0xfe30 (incorrect -> 0x5354), seq 929911764, ack 1531071532, win 65535, options [mss 65495,sackOK,TS val 1364598031 ecr 1364598031,nop,wscale 9], length 0
23:46:38.095956 IP (tos 0x0, ttl 64, id 20773, offset 0, flags [DF], proto TCP (6), length 52)
    localhost.57664 > localhost.3000: Flags [.], cksum 0xfe28 (incorrect -> 0x7b46), seq 1, ack 1, win 256, options [nop,nop,TS val 1364598031 ecr 1364598031], length 0
```

But Morty still saying 

> Warning! This instance does not support direct URL opening.

Is this normal ? if not, how can i fix it ?

Thanks
